{
  "$schema": "https://json-schema.org/draft/2020-12/schema",
  "$id": "score-interpretation-list.schema.json",

  "title": "Score Interpretation List",
  "description": "A collection of score interpretations that imply order via their naming or required proficiencies.",
  "type": "object",

  "properties": {
    "$schema": {
      "description": "JSON Schema version",
      "type": "string"
    },

    "owner": {
      "description": "The entity that maintains this score interpretation list. Domain name. Ex: 'example.com'",
      "type": "string",
      "format": "hostname",
      "pattern": "^[a-z0-9]+(?:-[a-z0-9]+)*\\.[a-z]{2,}$"
    },

    "name": {
      "description": "A namespace to associate the interpretations. Kebab case. Ex: 'my-list-name'",
      "type": "string",
      "format": "kebab-case",
      "pattern": "^[a-z0-9]+(?:-[a-z0-9]+)*$"
    },

    "description": {
      "description": "A brief description of the knowledge domain covered by this interpretation list.",
      "type": "string"
    },

    "version": {
      "description": "Version of this list. Semantic versioning format. Ex: '1.0.0'",
      "type": "string",
      "format": "semver",
      "pattern": "^(0|[1-9]\\d*)\\.(0|[1-9]\\d*)\\.(0|[1-9]\\d*)(?:-((?:0|[1-9]\\d*|\\d*[a-zA-Z-][0-9a-zA-Z-]*)(?:\\.(?:0|[1-9]\\d*|\\d*[a-zA-Z-][0-9a-zA-Z-]*))*))?(?:\\+([0-9a-zA-Z-]+(?:\\.[0-9a-zA-Z-]+)*))?$"
    },

    "issued-at": {
      "description": "ISO 8601 timestamp of when this version was created.",
      "type": "string",
      "format": "date-time"
    },

    "certificate": {
      "description": "x.509 certificate in PEM format with embedded Ed25519 signature used to verify authenticity of this interpretation list.",
      "format": "pem-certificate",
      "oneOf": [
        {
          "type": "string",
          "pattern": "^-----BEGIN CERTIFICATE-----\\r?\\n(?:[A-Za-z0-9+/]{64}\\r?\\n)+(?:[A-Za-z0-9+/]{1,64}=*\\r?\\n)-----END CERTIFICATE-----\\r?\\n?$"
        },
        {
          "type": "null"
        }
      ]
    },

    "score-interpretations": {
      "description": "Map of score interpretation identifiers to their definitions",
      "type": "object",
      "patternProperties": {
        "^[a-z0-9]+(?:-[a-z0-9]+)*$": {
          "$ref": "https://raw.githubusercontent.com/openproficiency/model/refs/heads/main/schemas/score-interpretation.schema.json"
        }
      },
      "additionalProperties": false
    },

    "dependencies": {
      "description": "Map of shorthand aliases to external topic list references",
      "type": "object",
      "patternProperties": {
        "^[a-z0-9]+(?:-[a-z0-9]+)*$": {
          "type": "string",
          "description": "HTTP(S) URL to a versioned topic list (YAML/JSON)",
          "format": "uri"
        }
      },
      "additionalProperties": false
    }
  },

  "required": [
    "owner",
    "name",
    "description",
    "version",
    "issued-at",
    "certificate",
    "score-interpretations"
  ],
  "additionalProperties": false
}
